{
  "$schema": "http://json-schema.org/draft-07/schema#",
  "title": "Fix Strategy — agent strategy input",
  "description": "The judgement half of a fix plan. Written by the Fix Strategist agent to .claude/.pipeline-context/fix-strategy/<issue_id>.strategy.json after reading the context briefing and the matched CWE catalog entry in full, then consumed by scripts/render-fix-plan.js. This is strategy only — no diff, no applied code. Illustrative code, if included, must not be presented as a patch; that is the Fixer agent's job.",
  "type": "object",
  "required": ["issue_id", "cwe", "plain_summary", "approach", "catalog_reference", "affected_files", "verification_plan"],
  "additionalProperties": false,
  "properties": {
    "issue_id": {
      "type": "string",
      "description": "Must match the id in the context bundle, e.g. ISSUE-001."
    },
    "cwe": {
      "type": "string",
      "description": "The single CWE this plan remediates, e.g. CWE-943. Pick the one that best names the root cause, not every CWE loosely related to the symptom."
    },
    "confidence": {
      "type": "string",
      "enum": ["High", "Medium", "Low"],
      "description": "High only when the catalog pattern applies cleanly to the defect site as described in the root cause report."
    },
    "plain_summary": {
      "type": "string",
      "description": "One sentence a non-engineer would understand: what the fix changes and why it closes the hole."
    },
    "approach": {
      "type": "string",
      "description": "2-5 sentences: the remediation strategy adapted from the catalog entry's canonical_approach to this specific defect site, and why it addresses the root cause rather than the symptom."
    },
    "catalog_reference": {
      "type": "object",
      "required": ["cwe", "title"],
      "additionalProperties": false,
      "properties": {
        "cwe": { "type": "string", "description": "The CWE id looked up in the catalog, e.g. CWE-943." },
        "title": {
          "type": ["string", "null"],
          "description": "The catalog entry's title. Set to null only when the detected CWE has no catalog entry (a catalog gap) — explain the gap in open_questions rather than inventing a pattern."
        }
      }
    },
    "alternatives_considered": {
      "type": "array",
      "items": { "type": "string" },
      "description": "Other remediation approaches considered and why they were rejected in favour of this one (e.g. why input blacklisting was rejected in favour of parameterised queries)."
    },
    "affected_files": {
      "type": "array",
      "minItems": 1,
      "description": "Per-file planned change. No diffs here — describe the change in prose; the Fixer writes the actual patch.",
      "items": {
        "type": "object",
        "required": ["file", "planned_change"],
        "additionalProperties": false,
        "properties": {
          "file": { "type": "string", "description": "Repo-relative path." },
          "planned_change": { "type": "string", "description": "What must change in this file and why, specific enough for the Fixer to act on without re-deriving the strategy." }
        }
      }
    },
    "illustrative_sketch": {
      "type": "string",
      "description": "Optional. A short Java snippet illustrating the target shape of the fix. Must be clearly illustrative — the Fixer may adapt it to match exact surrounding style, imports and error handling; it is not an applied patch."
    },
    "risk_notes": {
      "type": "array",
      "items": { "type": "string" },
      "description": "What the Fixer and a reviewer should watch for: behavioural changes, migration needs, performance implications, backward compatibility."
    },
    "verification_plan": {
      "type": "array",
      "minItems": 1,
      "items": { "type": "string" },
      "description": "Concrete, checkable steps that prove the fix works — what to compile/test, and how to confirm the original exploit/symptom from the issue no longer reproduces. The Fixer's verification must address these."
    },
    "open_questions": {
      "type": "array",
      "items": { "type": "string" },
      "description": "Anything the context bundle could not settle, including catalog gaps. Use this instead of guessing."
    },
    "dependency_upgrade": {
      "type": "object",
      "description": "Required only when cwe is CWE-1104 (or another dependency-version CWE added later). Turns 'bump the version' into machine-checkable facts that 04c-dependency-upgrader's verification script checks deterministically, instead of relying on prose alone. Mutually exclusive with version_migration: a platform parent/BOM crossing a major generation is a version_migration.",
      "required": ["maven_coordinate", "current_version", "minimum_fixed_version"],
      "additionalProperties": false,
      "properties": {
        "maven_coordinate": { "type": "string", "description": "groupId:artifactId, e.g. org.apache.poi:poi-ooxml." },
        "current_version": { "type": "string", "description": "The vulnerable version currently pinned/resolved." },
        "minimum_fixed_version": { "type": "string", "description": "The lowest version that remediates the advisory, per its own affected/fixed range — not necessarily 'latest'." },
        "cve": { "type": "string", "description": "The CVE id, if one exists, e.g. CVE-2025-31672." },
        "advisory_url": { "type": "string", "description": "Link to the advisory used to determine minimum_fixed_version." }
      }
    },
    "version_migration": {
      "type": "object",
      "description": "Present only when the remediation is a coordinated framework-generation and/or Java-level migration (Fix Type VERSION_MIGRATION, Stage 2 routes to 04d-version-migration) rather than a code fix or a single-coordinate bump. Record it when the platform parent/BOM must move to a new major generation, when the Java level must change, or when the issue explicitly asks for a framework migration. render-fix-plan.js verifies every field against the build descriptor on disk (scripts/lib/routing.js) and refuses a claim the evidence does not support. Mutually exclusive with dependency_upgrade.",
      "required": ["project", "platform", "platform_coordinate", "source_version", "target_version"],
      "additionalProperties": false,
      "properties": {
        "project": { "type": "string", "description": "Repo-relative directory holding the project's build descriptor, e.g. src/employee-service." },
        "platform": { "type": "string", "description": "Human name of the platform, e.g. Spring Boot." },
        "platform_coordinate": { "type": "string", "description": "groupId:artifactId whose declared version is the platform version, e.g. org.springframework.boot:spring-boot-starter-parent." },
        "source_version": { "type": "string", "description": "The version the descriptor declares today — must match it exactly." },
        "target_version": { "type": "string", "description": "The exact requested target version, e.g. 4.1.1. Never 'latest'." },
        "source_java": { "type": "string", "description": "The Java level the descriptor declares today, e.g. 17." },
        "target_java": { "type": "string", "description": "The Java level the migration must reach, e.g. 21." },
        "reason": { "type": "string", "description": "Why a coordinated migration (and not a single bump) is required." }
      }
    },
    "derived_pattern": {
      "type": "object",
      "description": "Present ONLY when this strategy was produced by the 04a1 remediation-intelligence fallback because the CWE had no catalog entry. Records where the derived pattern came from so a reviewer and the audit stage can trace it to a real, local source. Full shape: ../../04a1-remediation-intelligence/templates/derived_pattern.schema.json. A catalogued (04a) plan omits this field.",
      "required": ["source_type", "sources", "kb_entry", "note"],
      "additionalProperties": true,
      "properties": {
        "source_type": { "type": "string", "enum": ["expanded-catalog", "historical-fix", "external", "blend"] },
        "sources": { "type": "array", "items": { "type": "string" }, "minItems": 1 },
        "kb_entry": { "type": ["string", "null"] },
        "ranked_examples": { "type": "array", "items": { "type": "object" } },
        "note": { "type": "string" }
      }
    }
  }
}
